{
    "type": "qsar-filter-2",
    "label": "QSAR Filter v2",
    "category": "analysis",
    "icon": "filtericon",
    "color": "red",
    "description": "Filter compounds based on QSAR data and physicochemical thresholds.",
    "defaultInputs": [
        {
            "id": "input-mol-data",
            "name": "Input Compounds",
            "type": "array",
            "required": true,
            "description": "Array containing compound data and SMILES strings from CSV"
        }
    ],
    "defaultOutputs": [
        {
            "id": "output-filtered",
            "name": "Filtered Results",
            "type": "array",
            "description": "Output data containing filtered compound results"
        }
    ],
    "configSchema": [
        {
            "key": "qsar_models",
            "type": "select",
            "label": "QSAR Models",
            "options": [
                { "value": "chem_prop", "label": "ChemProp - best for fast predictions" },
                { "value": "opera", "label": "OPERA - Regulatory-grade QSAR predictions" },
                { "value": "qsprpred", "label": "QSPRpred - Flexible model building & benchmarking tasks" }
            ]
        },
        {
            "key": "prediction_endpoint",
            "type": "select",
            "label": "Prediction Endpoint",
            "showWhen": [
                { "field": "qsar_models", "in": ["chem_prop"] }
            ],
            "options": [
                { "value": "toxicity", "label": "Toxicity" },
                { "value": "solubility", "label": "Solubility" },
                { "value": "bioavailability", "label": "Bioavailability" },
                { "value": "permeability", "label": "Permeability" }
            ]
        },
        {
            "key": "confidence_threshold",
            "type": "number",
            "label": "Confidence Threshold (%)",
            "placeholder": "Enter threshold (0-100)",
            "showWhen": [
                { "field": "qsar_models", "in": ["chem_prop", "opera"] }
            ],
            "defaultValue": 70
        },
        {
            "key": "toxicity_detail",
            "type": "textarea",
            "label": "Toxicity Analysis Notes",
            "placeholder": "Enter specific toxicity parameters or notes...",
            "showWhen": [
                { "field": "qsar_models", "in": ["chem_prop"] },
                { "field": "prediction_endpoint", "in": ["toxicity"] }
            ]
        },
        {
            "key": "opera_descriptor_set",
            "type": "select",
            "label": "OPERA Descriptor Set",
            "showWhen": [
                { "field": "qsar_models", "in": ["opera"] }
            ],
            "options": [
                { "value": "standard", "label": "Standard Descriptors" },
                { "value": "extended", "label": "Extended Descriptors" },
                { "value": "minimal", "label": "Minimal Descriptors" }
            ],
            "defaultValue": "standard",
            "advanced": true
        },
        {
            "key": "qsprpred_training_mode",
            "type": "select",
            "label": "Training Mode",
            "showWhen": [
                { "field": "qsar_models", "in": ["qsprpred"] }
            ],
            "options": [
                { "value": "quick", "label": "Quick Training" },
                { "value": "standard", "label": "Standard Training" },
                { "value": "extensive", "label": "Extensive Training" }
            ],
            "defaultValue": "standard"
        },
        {
            "key": "qsprpred_validation_split",
            "type": "number",
            "label": "Validation Split (%)",
            "placeholder": "Enter percentage (10-50)",
            "showWhen": [
                { "field": "qsar_models", "in": ["qsprpred"] }
            ],
            "defaultValue": 20
        },
        {
            "key": "enable_batch_processing",
            "type": "boolean",
            "label": "Enable Batch Processing",
            "showWhen": [
                { "field": "qsar_models", "in": ["chem_prop", "opera"] }
            ],
            "defaultValue": false,
            "advanced": true
        },
        {
            "key": "batch_size",
            "type": "number",
            "label": "Batch Size",
            "placeholder": "Enter batch size",
            "showWhen": [
                { "field": "qsar_models", "in": ["chem_prop", "opera"] },
                { "field": "enable_batch_processing", "in": ["true"] }
            ],
            "defaultValue": 32,
            "advanced": true
        }
    ]
}