{
  "type": "market-industry-trend",
  "label": "Market Industry Trend",
  "category": "analysis",
  "icon": "chartBar",
  "color": "orange",
  "description": "Map industry and category choices to sub-category opportunities, competitive intensity (trend stage), and key brands for benchmarking.",
  "defaultInputs": [],
  "defaultOutputs": [
    {
      "id": "sub_category",
      "name": "Sub-category",
      "type": "string",
      "description": "Specific market micro-space within the selected category (e.g. \"Hair growth + caffeine / niacinamide\")."
    },
    {
      "id": "trend_stage",
      "name": "Trend Stage",
      "type": "string",
      "description": "Competitive intensity / maturity of the sub-category, visualized as colored dots (e.g. ðŸ”´ Overcrowded, ðŸŸ¡ Emerging, ðŸŸ¢ Underserved)."
    },
    {
      "id": "key_brands",
      "name": "Key Brands",
      "type": "string",
      "description": "Representative brands active in the sub-category, useful for benchmarking and inspiration."
    }
  ],
  "configSchema": [
    {
      "key": "industry",
      "type": "select",
      "label": "Industry",
      "options": [
        { "value": "consumer_health", "label": "Consumer Health" },
        { "value": "pharmaceuticals", "label": "Pharmaceuticals" },
        { "value": "supplement", "label": "Supplement" }
      ],
      "description": "Select the overarching industry context for the trend assessment (from the three columns in the matrix)."
    },
    {
      "key": "category",
      "type": "multiselect",
      "label": "Category",
      "options": [
        { "value": "hair_scalp_health", "label": "Hair & Scalp Health" },
        { "value": "skin_health", "label": "Skin Health" },
        { "value": "digestive_health", "label": "Digestive Health" },
        { "value": "sleep_stress", "label": "Sleep & Stress" },
        { "value": "dermatology", "label": "Dermatology" },
        { "value": "neurology", "label": "Neurology" },
        { "value": "cardiometabolic", "label": "Cardiometabolic" },
        { "value": "metabolic_support", "label": "Metabolic Support" },
        { "value": "cognitive_health", "label": "Cognitive Health" },
        { "value": "joint_mobility", "label": "Joint & Mobility" },
        { "value": "immune_support", "label": "Immune Support" }
      ],
      "description": "Choose one or more categories from the attached matrix:\n- **Consumer Health** â†’ Hair & Scalp Health, Skin Health, Digestive Health, Sleep & Stress\n- **Pharmaceuticals** â†’ Dermatology, Neurology, Cardiometabolic\n- **Supplement** â†’ Metabolic Support, Cognitive Health, Joint & Mobility, Immune Support"
    },
    {
      "key": "from_year",
      "type": "number",
      "label": "From Year",
      "placeholder": "e.g. 2015",
      "description": "Start of the time horizon for evaluating competitive intensity and brand activity (inclusive)."
    },
    {
      "key": "to_year",
      "type": "number",
      "label": "To Year",
      "placeholder": "e.g. 2025",
      "description": "End of the time horizon for evaluating competitive intensity and brand activity (inclusive)."
    },
    {
      "key": "religion",
      "type": "select",
      "label": "Region (Optional)",
      "options": [
        { "value": "global", "label": "Global" },
        { "value": "asia", "label": "Asia" },
        { "value": "eu", "label": "EU" },
        { "value": "us", "label": "US" },
        { "value": "africa", "label": "Africa" },
        { "value": "oceania", "label": "Oceania" }
      ],
      "description": "Optional regional filter for the trend assessment. Leave empty for a global view."
    }
  ]
}


