{
  "type": "target-mapping",
  "label": "Target discovery and prioritization",
  "category": "analysis",
  "icon": "target-icon",
  "color": "blue",
  "description": "Maps protein names or biological descriptions to assay metrics. Supports manual free-text input or automated lookup.",
  "pricing": {
    "credits": 800,
    "executionTime": 1
  },
  "outputMockLabel": "5 targets",
  "defaultInputs": [
    {
      "id": "target-input",
      "name": "Target/Protein Input",
      "type": "string",
      "required": false,
      "tooltip": "Optional input port carrying protein names or biological descriptions from previous steps."
    }
  ],
  "defaultOutputs": [
    {
      "id": "target",
      "name": "Protein target",
      "type": "string",
      "tooltip": "Protein target name"
    },
    {
      "id": "organism",
      "name": "Organism",
      "type": "string",
      "tooltip": "Organism"
    },
    {
      "id": "biological_system",
      "name": "Biological system",
      "type": "string",
      "tooltip": "Biological system"
    },
    {
      "id": "desired_modulation",
      "name": "Desired modulation",
      "type": "string",
      "tooltip": "Desired modulation"
    },
    {
      "id": "assay",
      "name": "Corresponding assay",
      "type": "string",
      "tooltip": "Corresponding assay"
    },
    {
      "id": "metric",
      "name": "Metric used",
      "type": "string",
      "tooltip": "Metric used"
    },
    {
      "id": "rationale",
      "name": "Rationale",
      "type": "string",
      "tooltip": "Rationale"
    },
    {
      "id": "crystallized_structure_available",
      "name": "Crystallized structure available?",
      "type": "string",
      "tooltip": "Crystallized structure available?"
    },
    {
      "id": "uniprot_accession",
      "name": "UniProt accession number",
      "type": "string",
      "tooltip": "UniProt accession number"
    },
    {
      "id": "chembl",
      "name": "Chembl",
      "type": "string",
      "tooltip": "Chembl"
    }
  ],
  "configSchema": [
    {
      "key": "manualFreetext",
      "type": "textarea",
      "label": "Target Input",
      "placeholder": "Enter target name or biological effect...",
      "tooltip": "Use this when you want to type a target or biological effect manually instead of wiring it from another node."
    }
  ],
  "defaultConfig": {
    "manualFreetext": "",
    "mappingTable": [
      {
        "target": "CDK20",
        "organism": "Human",
        "biological_system": "Hepatocellular carcinoma (cell-cycle regulation)",
        "desired_modulation": "Direct inhibition",
        "assay": "Biochemical kinase binding assay",
        "metric": "Kd / IC₅₀",
        "rationale": "Strong multi-omics association with HCC; oncogenic role via CDK2 activation; kinase druggability with limited prior structural/chemical data",
        "crystallized_structure_available": "No",
        "uniprot_accession": "Q8IZL9",
        "chembl": "CHEMBL3559690"
      },
      {
        "target": "CDK2",
        "organism": "Human",
        "biological_system": "Pan-cancer cell-cycle control",
        "desired_modulation": "Direct inhibition",
        "assay": "Enzymatic kinase activity assay",
        "metric": "IC₅₀",
        "rationale": "Well-validated CDK with strong cancer relevance; included as a reference comparator",
        "crystallized_structure_available": "Yes",
        "uniprot_accession": "P24941",
        "chembl": "CHEMBL301"
      },
      {
        "target": "PLK1",
        "organism": "Human",
        "biological_system": "Mitotic regulation in cancer",
        "desired_modulation": "Direct inhibition",
        "assay": "Enzymatic kinase assay",
        "metric": "IC₅₀",
        "rationale": "High expression in proliferative tumors; classic mitotic kinase target",
        "crystallized_structure_available": "Yes",
        "uniprot_accession": "P53350",
        "chembl": "CHEMBL3024"
      },
      {
        "target": "AURKA",
        "organism": "Human",
        "biological_system": "Mitotic spindle assembly",
        "desired_modulation": "Direct inhibition",
        "assay": "Cell-based proliferation assay",
        "metric": "GI₅₀ / IC₅₀",
        "rationale": "Strong cancer driver with abundant literature; used to anchor target ranking",
        "crystallized_structure_available": "Yes",
        "uniprot_accession": "O14965",
        "chembl": "CHEMBL4722"
      },
      {
        "target": "TTK",
        "organism": "Human",
        "biological_system": "Spindle checkpoint signaling",
        "desired_modulation": "Direct inhibition",
        "assay": "Enzymatic kinase assay",
        "metric": "IC₅₀",
        "rationale": "Oncology relevance with partial structural coverage; moderate novelty",
        "crystallized_structure_available": "Partial",
        "uniprot_accession": "P33981",
        "chembl": "CHEMBL3983"
      }
    ]
  }
}
