{
  "type": "filter",
  "label": "Filter",
  "category": "transform",
  "icon": "filter",
  "color": "green",
  "description": "Filter data based on conditions. All conditions are combined with AND logic.",
  "defaultInputs": [
    {
      "id": "data",
      "name": "data",
      "type": "array",
      "required": true,
      "description": "Data to filter"
    }
  ],
  "defaultOutputs": [],
  "configSchema": [
    {
      "key": "filterRules",
      "type": "filter",
      "label": "Filter Conditions",
      "description": "Define conditions to filter data. All conditions are combined with AND logic."
    }
  ]
}
