{
  "type": "bioactivity-filter",
  "label": "Bioactivity Filter",
  "category": "analysis",
  "icon": "activity",
  "color": "green",
  "description": "Filter compound bioactivity (IC50) against TAS2R14, TRPV1, and TRPA1 receptors.",
  "pricing": {
    "credits": 800,
    "executionTime": 1
  },
  "outputMockLabel": "CDK20",
  "defaultInputs": [
    {
      "id": "compoundList",
      "name": "Compound List",
      "type": "array",
      "required": true,
      "tooltip": "Input table of compounds (IDs and SMILES) to score."
    },
    {
      "id": "targetList",
      "name": "Target List",
      "type": "array",
      "required": true,
      "tooltip": "Targets or assays (EC50 / IC50) that bioactivity should be predicted against."
    }
  ],
  "defaultOutputs": [
    {
      "id": "Rank",
      "name": "Rank",
      "type": "number",
      "tooltip": "Rank of the compound based on bioactivity score."
    },
    {
      "id": "Compound",
      "name": "Compound",
      "type": "string",
      "tooltip": "Name of the compound."
    },
    {
      "id": "DTIGN–LigoSpace Bioactivity Score",
      "name": "DTIGN–LigoSpace Bioactivity Score",
      "type": "number",
      "tooltip": "Combined bioactivity score from DTIGN and LigoSpace models."
    },
    {
      "id": "Predicted % Inhibition (0.05 µM)",
      "name": "Predicted % Inhibition (0.05 µM)",
      "type": "string",
      "tooltip": "Predicted percentage inhibition at 0.05 µM (CHEMBL5703826 - Inhibition of CDK20 Lys2 labeling in human A-375 cells at 0.05 µM, measured by KiNativ profiling)."
    },
    {
      "id": "Confidence",
      "name": "Confidence",
      "type": "string",
      "tooltip": "Confidence level of the prediction (High, Medium, Low)."
    }
  ],
  "configSchema": [
    {
      "key": "dockingListText",
      "type": "text",
      "label": "Compound-Target Docking List",
      "tooltip": "Input the compound-target docking for bioactivity prediction",
      "suggestedField": ["docked_structure"]
    },
    {
      "key": "modelType",
      "type": "multiselect",
      "label": "Available Tools",
      "options": [
        {
          "value": "dtign",
          "label": "DTIGN - Best for fast predictions"
        },
        {
          "value": "ligospace",
          "label": "Ligospace - Best for accurate predictions"
        }
      ],
      "defaultValue": "Ligospace",
      "tooltip": "Select the bioactivity engine: **DTIGN** for speed, **Ligospace** for higher accuracy."
    },
    {
      "key": "dockingFiles",
      "type": "file",
      "label": "Docking Files",
      "multiple": true,
      "tooltip": "Optional upload of docking results."
    }
  ]
}
