{
  "type": "market-competition-claim",
  "label": "Market Competition by Claim",
  "category": "analysis",
  "icon": "scaleBalance",
  "color": "red",
  "description": "Assess competitive intensity by marketing claim, showing number of SKUs and evaluation of white space vs saturation.",
  "defaultInputs": [],
  "defaultOutputs": [
    {
      "id": "claim",
      "name": "Claim",
      "type": "string",
      "description": "Front-of-pack or marketing claim (e.g. \"Anti-hair fall / reduces hair loss\", \"Promotes hair growth\")."
    },
    {
      "id": "sku_count",
      "name": "# SKU in the Market",
      "type": "string",
      "description": "Approximate number of SKUs in the market carrying this claim (e.g. \"150+\", \"8\")."
    },
    {
      "id": "evaluation",
      "name": "Evaluation",
      "type": "string",
      "description": "Qualitative assessment of competitive intensity, often visualized with colored dots (e.g. ðŸ”´ Saturated, ðŸŸ¡ Medium, ðŸŸ¢ White space)."
    }
  ],
  "configSchema": [
    {
      "key": "industry",
      "type": "select",
      "label": "Industry",
      "options": [
        { "value": "consumer_health", "label": "Consumer Health" },
        { "value": "pharmaceuticals", "label": "Pharmaceuticals" },
        { "value": "supplement", "label": "Supplement" }
      ],
      "description": "Select the overarching industry context for the claim-level competition assessment."
    },
    {
      "key": "category",
      "type": "multiselect",
      "label": "Category",
      "options": [
        { "value": "hair_scalp_health", "label": "Hair & Scalp Health" },
        { "value": "skin_health", "label": "Skin Health" },
        { "value": "digestive_health", "label": "Digestive Health" },
        { "value": "sleep_stress", "label": "Sleep & Stress" },
        { "value": "dermatology", "label": "Dermatology" },
        { "value": "neurology", "label": "Neurology" },
        { "value": "cardiometabolic", "label": "Cardiometabolic" },
        { "value": "metabolic_support", "label": "Metabolic Support" },
        { "value": "cognitive_health", "label": "Cognitive Health" },
        { "value": "joint_mobility", "label": "Joint & Mobility" },
        { "value": "immune_support", "label": "Immune Support" }
      ],
      "description": "Choose one or more categories from the attached matrix:\n- **Consumer Health** â†’ Hair & Scalp Health, Skin Health, Digestive Health, Sleep & Stress\n- **Pharmaceuticals** â†’ Dermatology, Neurology, Cardiometabolic\n- **Supplement** â†’ Metabolic Support, Cognitive Health, Joint & Mobility, Immune Support"
    },
    {
      "key": "from_year",
      "type": "number",
      "label": "From Year",
      "placeholder": "e.g. 2015",
      "description": "Start of the time horizon for counting SKUs and assessing competition (inclusive)."
    },
    {
      "key": "to_year",
      "type": "number",
      "label": "To Year",
      "placeholder": "e.g. 2025",
      "description": "End of the time horizon for counting SKUs and assessing competition (inclusive)."
    },
    {
      "key": "religion",
      "type": "select",
      "label": "Region (Optional)",
      "options": [
        { "value": "global", "label": "Global" },
        { "value": "asia", "label": "Asia" },
        { "value": "eu", "label": "EU" },
        { "value": "us", "label": "US" },
        { "value": "africa", "label": "Africa" },
        { "value": "oceania", "label": "Oceania" }
      ],
      "description": "Optional regional filter for claim-level competition. Leave empty for a global view."
    }
  ]
}


