{
    "type": "bioactivity-filter",
    "label": "Bioactivity Filter",
    "category": "analysis",
    "icon": "activity",
    "color": "green",
    "description": "Filter compound bioactivity (IC50) against TAS2R14, TRPV1, and TRPA1 receptors.",
    "pricing": {
        "credits": 800,
        "executionTime": 1
    },
    "outputMockLabel": "5 compounds",
    "defaultInputs": [
        {
            "id": "compoundList",
            "name": "Compound List",
            "type": "array",
            "required": true,
            "tooltip": "Input table of compounds (IDs and SMILES) to score."
        },
        {
            "id": "targetList",
            "name": "Target List",
            "type": "array",
            "required": true,
            "tooltip": "Targets or assays (EC50 / IC50) that bioactivity should be predicted against."
        }
    ],
    "defaultOutputs": [
        {
            "id": "compound",
            "name": "Compound",
            "type": "string",
            "tooltip": "Compound identifier"
        },
        {
            "id": "tas2r14_ic50",
            "name": "TAS2R14 - IC50 (µM)",
            "type": "string",
            "tooltip": "IC50 for TAS2R14 (Assay: CHEMBL3887148)"
        },
        {
            "id": "trpv1_ic50",
            "name": "TRPV1 - IC50 (µM)",
            "type": "string",
            "tooltip": "IC50 for TRPV1 (Assay: CHEMBL4794)"
        },
        {
            "id": "trpa1_ic50",
            "name": "TRPA1 - IC50 (µM)",
            "type": "string",
            "tooltip": "IC50 for TRPA1 (Assay: CHEMBL1118499)"
        }
    ],
    "configSchema": [
        {
            "key": "dockingListText",
            "type": "text",
            "label": "Compound-Target Docking List",
            "tooltip": "Input the compound-target docking for bioactivity prediction",
            "suggestedField": [
                "docked_structure"
            ]
        },
        {
            "key": "modelType",
            "type": "select",
            "label": "Available Tools",
            "options": [
                {
                    "value": "dtign",
                    "label": "DTIGN - Best for fast predictions"
                },
                {
                    "value": "ligospace",
                    "label": "Ligospace - Best for accurate predictions"
                }
            ],
            "defaultValue": "Ligospace",
            "tooltip": "Select the bioactivity engine: **DTIGN** for speed, **Ligospace** for higher accuracy."
        },
        {
            "key": "dockingFiles",
            "type": "file",
            "label": "Docking Files",
            "multiple": true,
            "tooltip": "Optional upload of docking results."
        }
    ]
}