{
  "type": "ingredient-interaction-risk-synergy-analysis",
  "label": "Ingredient interaction & Risk synergy analysis",
  "category": "analysis",
  "icon": "alert-triangle",
  "color": "red",
  "description": "Analyze synergistic effects and safety risks of ingredient pairs by combining compound-SMILES pairs",
  "outputMockLabel": "13 pairs",
  "pricing": {
    "credits": 0,
    "executionTime": 1
  },
  "defaultInputs": [
    {
      "id": "compoundList",
      "name": "Compound List",
      "type": "array",
      "required": true,
      "description": "List of compounds with SMILES strings",
      "tooltip": "Input table of compounds with names and SMILES strings. The module will analyze all possible pairs for synergistic effects and safety risks."
    }
  ],
  "defaultOutputs": [
    {
      "id": "Pair",
      "name": "Pair",
      "type": "string",
      "tooltip": "The pair of compounds being analyzed (e.g., 'Methylglyoxal × Dihydroxyacetone', 'Leptosperin × Methyl syringate')."
    },
    {
      "id": "Predicted Synergistic Signal",
      "name": "Predicted Synergistic Signal",
      "type": "string",
      "tooltip": "The predicted synergistic signal describing the type of interaction between the compound pair (e.g. 'Complementary precursor–active relationship', 'Co-occurrence stability signal', 'Functional complementarity')."
    },
    {
      "id": "Synergy Type (Dominant)",
      "name": "Synergy Type (Dominant)",
      "type": "string",
      "tooltip": "The dominant synergy type or mechanism of interaction (e.g. 'Formation / availability support', 'Matrix stabilization / persistence', 'Bioactive + antioxidant balance', 'Antioxidant breadth')."
    },
    {
      "id": "Confidence",
      "name": "Confidence",
      "type": "number",
      "tooltip": "Confidence score for the predicted synergistic signal (0-1 scale, e.g. 0.72, 0.61, 0.58)."
    },
    {
      "id": "Flag",
      "name": "Flag",
      "type": "string",
      "tooltip": "Safety flag indicating the risk level: 'Safe' (no significant risk), 'Low Risk' (minimal concerns with monitoring recommended)."
    }
  ],
  "configSchema": [
    {
      "key": "compoundListText",
      "type": "text",
      "label": "Compound List (Paste)",
      "placeholder": "Compound A,SMILES_A\nCompound B,SMILES_B\n...",
      "tooltip": "Paste compound names and SMILES strings, one per line, separated by comma. Format: CompoundName,SMILES",
      "suggestedField": [
        "name",
        "Compound_name",
        "Compound",
        "SMILES",
        "smiles"
      ]
    },
    {
      "key": "compoundFile",
      "type": "file",
      "label": "Upload Compound File",
      "accept": ".csv,.txt",
      "tooltip": "Upload a CSV or TXT file containing compound names and SMILES strings. Required columns: compound name/identifier and SMILES."
    },
    {
      "key": "analysisMode",
      "type": "select",
      "label": "Analysis Mode",
      "options": [
        {
          "value": "all_pairs",
          "label": "All Pairs (Exhaustive)"
        },
        {
          "value": "selected_pairs",
          "label": "Selected Pairs Only"
        }
      ],
      "defaultValue": "all_pairs",
      "tooltip": "Choose whether to analyze all possible compound pairs or only selected pairs."
    },
    {
      "key": "riskThreshold",
      "type": "number",
      "label": "Risk Threshold",
      "placeholder": "e.g., 0.7",
      "defaultValue": 0.5,
      "tooltip": "Minimum confidence threshold for flagging high-risk interactions (0-1 scale)."
    },
    {
      "key": "includeLowRisk",
      "type": "boolean",
      "label": "Include Low Risk Pairs",
      "defaultValue": true,
      "tooltip": "Include pairs with low risk scores in the output results."
    }
  ],
  "defaultConfig": {
    "analysisMode": "all_pairs",
    "riskThreshold": 0.5,
    "includeLowRisk": true
  }
}

