{
  "type": "insilico-compound-filter",
  "label": "In-silico Compound Filter",
  "category": "analysis",
  "icon": "biotech",
  "color": "indigo",
  "description": "Evaluates compounds using user-configurable criteria, tools, methods, and thresholds for Toxicity, Bioactivity, and Developability.",
  "pricing": {
    "credits": 0,
    "executionTime": 1
  },
  "defaultInputs": [],
  "defaultOutputs": [
    {
      "id": "target",
      "name": "Target",
      "type": "string",
      "description": "Biological protein target (e.g., Kir6.2, GSK3Î²)"
    },
    {
      "id": "assay_type",
      "name": "Assay Type",
      "type": "string",
      "description": "The laboratory method used (e.g., Enzyme Inhibition)"
    },
    {
      "id": "compound",
      "name": "Compound",
      "type": "string",
      "description": "Name of the chemical compound"
    },
    {
      "id": "activity_type",
      "name": "Activity Type",
      "type": "string",
      "description": "Measurement metric (IC50 or EC50)"
    },
    {
      "id": "p_value",
      "name": "p-Value",
      "type": "string",
      "description": "Raw metric value (p-Value)"
    },
    {
      "id": "status",
      "name": "Status",
      "type": "string",
      "description": "Indicator: GREEN (Pass), YELLOW (Tolerance), RED (Fail)"
    },
    {
      "id": "confidence_score",
      "name": "Confidence",
      "type": "number",
      "description": "Model confidence score"
    }
  ],
  "configSchema": [
    {
      "key": "toxicityCriteria",
      "type": "textarea",
      "label": "Toxicity Configuration",
      "placeholder": "Enter Tools/Models, Methods, and Threshold + Comparison logic...",
      "defaultValue": ""
    },
    {
      "key": "bioactivityCriteria",
      "type": "textarea",
      "label": "Bioactivity (Docking) Criteria",
      "placeholder": "Enter Tools, Docking methods, and Thresholds...",
      "defaultValue": ""
    },
    {
      "key": "developabilityCriteria",
      "type": "textarea",
      "label": "Developability Criteria",
      "placeholder": "Enter Threshold ranges and Tolerance settings...",
      "defaultValue": ""
    }
  ],
  "defaultConfig": {
    "toxicityCriteria": "",
    "bioactivityCriteria": "",
    "developabilityCriteria": ""
  }
}